{
  "schemaVersion": "1.5",
  "key": "mileage-for-clockify",
  "name": "Mileage for Clockify",
  "baseUrl": "${ADDON_BASE_URL}",
  "minimalSubscriptionPlan": "PRO",
  "description": "Create and convert precise mileage reimbursements into real Clockify flat expenses while keeping Clockify as the source of truth for expense reports, receipts, approvals, budgets, and invoices.",
  "iconPath": "/assets/mileage/icon.png",
  "scopes": [
    "EXPENSE_READ",
    "EXPENSE_WRITE",
    "USER_READ",
    "PROJECT_READ",
    "WORKSPACE_READ"
  ],
  "lifecycle": [
    {
      "type": "INSTALLED",
      "path": "/lifecycle/installed"
    },
    {
      "type": "DELETED",
      "path": "/lifecycle/deleted"
    },
    {
      "type": "SETTINGS_UPDATED",
      "path": "/lifecycle/settings-updated"
    },
    {
      "type": "STATUS_CHANGED",
      "path": "/lifecycle/status-changed"
    }
  ],
  "webhooks": [
    {
      "event": "EXPENSE_CREATED",
      "path": "/webhook/expense-created"
    },
    {
      "event": "EXPENSE_UPDATED",
      "path": "/webhook/expense-updated"
    },
    {
      "event": "EXPENSE_DELETED",
      "path": "/webhook/expense-deleted"
    },
    {
      "event": "EXPENSE_RESTORED",
      "path": "/webhook/expense-restored"
    }
  ],
  "components": [
    {
      "type": "sidebar",
      "label": "Mileage",
      "accessLevel": "EVERYONE",
      "path": "/iframe/mileage",
      "iconPath": "/assets/mileage/icon.png"
    }
  ],
  "settings": "/iframe/settings"
}
